{
  "id": "system-review-planning",
  "name": "Review planning suite",
  "description": "Read stored records with item_fetch. The suite task reports gaps, repairs them, and returns links. Do not mark work Done. Do not start implementation.",
  "content": {
    "id": "system-review-planning",
    "name": "Review planning suite",
    "description": "Check membership, criteria, and dependencies, then repair omissions.",
    "runtime_inputs": [
      {
        "key": "manifest",
        "input_type": "string",
        "required": true,
        "label": "Planning manifest JSON"
      },
      {
        "key": "run_id",
        "input_type": "string",
        "required": true,
        "label": "Planning run id"
      }
    ],
    "tasks": [
      {
        "id": "read",
        "name": "Read stored records",
        "function": {
          "name": "command",
          "input": {
            "prompt": "You are the Review stage. The validated manifest is {{runtime.manifest}} for run {{runtime.run_id}}. Use item_fetch to read the milestone and its stories. Do not call item_call. Do not mark work Done. Do not start implementation. Reply with any missing member or criterion you observed."
          }
        },
        "next_tasks": [
          {
            "id": "review",
            "name": "Repair and return record links",
            "capture_output": true,
            "function": {
              "name": "planning_suite",
              "input": {
                "operation": "review",
                "manifest_runtime_key": "manifest",
                "run_runtime_key": "run_id"
              }
            }
          }
        ]
      }
    ]
  }
}
