{
  "id": "system-publish-ready-planning",
  "name": "Publish planning readiness",
  "description": "Review the stored case against the validated manifest. Publish a ready digest when every surface is covered and no product choice is open. Do not mark work Done. Do not start implementation.",
  "content": {
    "id": "system-publish-ready-planning",
    "name": "Publish planning readiness",
    "description": "Emit PlanReady when the reviewed case is evidence complete.",
    "runtime_inputs": [
      {
        "key": "manifest",
        "input_type": "string",
        "required": true,
        "label": "Planning manifest JSON"
      },
      {
        "key": "run_id",
        "input_type": "string",
        "required": true,
        "label": "Planning case id"
      }
    ],
    "tasks": [
      {
        "id": "validate",
        "name": "Bind validated manifest",
        "capture_output": true,
        "function": {
          "name": "planning_manifest",
          "input": {
            "manifest_runtime_key": "manifest"
          }
        },
        "next_tasks": [
          {
            "id": "read",
            "name": "Read stored records",
            "function": {
              "name": "command",
              "input": {
                "prompt": "You are the Ready stage. The validated manifest is already bound for case {{runtime.run_id}}. Use item_fetch to read the milestone, stories, and planning case. Do not call item_call. Do not mark work Done. Do not start implementation. Reply with whether every necessary surface is mapped and every fact is checked."
              }
            },
            "next_tasks": [
              {
                "id": "ready",
                "name": "Publish ready digest",
                "capture_output": true,
                "function": {
                  "name": "planning_ready",
                  "input": {
                    "case_runtime_key": "run_id"
                  }
                }
              }
            ]
          }
        ]
      }
    ]
  }
}
