{
  "id": "system-implement-story",
  "name": "Implement story",
  "description": "Runs an installed agent command to implement a single story.",
  "content": {
    "id": "implement-story",
    "name": "Implement story",
    "runtime_inputs": [
      {
        "input_type": "string",
        "key": "story_id",
        "label": "Story id",
        "required": true
      }
    ],
    "tasks": [
      {
        "id": "implement_story",
        "name": "Implement story",
        "function": {
          "name": "command",
          "input": {
            "config": { "cursor_model": "composer-2.5[fast=false]" },
            "prompt": "{{prompt.system-implement-story}}"
          }
        },
        "next_tasks": [
          {
            "id": "report_done",
            "name": "Report completion",
            "function": {
              "name": "cli_command",
              "input": {
                "command": "echo",
                "args": [
                  "implement-story finished for {{runtime.story_id}}"
                ]
              }
            },
            "next_tasks": []
          }
        ]
      }
    ]
  }
}
